{
 "schema_version": 1,
 "id": "landing",
 "name": "Product site",
 "when": "Marketing sites for a product or service: a visitor decides in minutes whether to sign up, buy or get in touch.",
 "actors": [
  {
   "actor": "evaluating_visitor",
   "who": "Someone who arrived with a problem and is deciding whether this product solves it.",
   "questions": [
    "What problem were they trying to solve when they arrived, in their own words?",
    "Where did they come from (search, a recommendation, an ad, a comparison article)?",
    "What do they need to see before they believe it works for someone like them?",
    "What stops them from signing up today: price, effort, risk, someone else's approval?",
    "Who else is involved in the decision, and what will that person ask?"
   ]
  },
  {
   "actor": "returning_buyer",
   "who": "Someone who has seen the site before and comes back to compare plans or to buy.",
   "questions": [
    "What did they come back to check?",
    "Which plan details decide between two plans for them?",
    "What would make them contact sales instead of signing up themselves?"
   ]
  }
 ],
 "screens": [
  { "id": "home", "name": "Home", "lens": "marketing", "does": "Understands what this is, who it is for and what to do next." },
  { "id": "feature", "name": "Feature or use-case page", "lens": "marketing", "does": "Sees how the product handles their specific case." },
  { "id": "pricing", "name": "Pricing", "lens": "marketing", "does": "Works out what it will cost them and which plan fits." },
  { "id": "sign-up", "name": "Sign up", "lens": "transaction", "does": "Creates an account with as little as is needed to start." },
  { "id": "contact", "name": "Contact sales", "lens": "transaction", "does": "Asks a question and knows when they will hear back." },
  { "id": "docs", "name": "Docs or help", "lens": "content", "does": "Checks a detail before committing." }
 ],
 "journeys": [
  {
   "id": "understand-and-sign-up",
   "goal": "Understand the product and sign up",
   "actor": "evaluating_visitor",
   "through": ["home", "feature", "sign-up"],
   "watch": [
    "What the product is and who it is for is readable without scrolling at a phone viewport.",
    "Each view has one primary call to action, and it says what happens when pressed.",
    "Count the sign-up fields; each must be needed to start."
   ]
  },
  {
   "id": "compare-plans",
   "goal": "Choose a plan",
   "actor": "returning_buyer",
   "through": ["home", "pricing", "sign-up"],
   "watch": [
    "Prices state the period, the currency and whether tax is included.",
    "The differences between plans can be read without hovering or opening anything.",
    "The plan chosen on pricing is the plan selected in sign-up."
   ]
  },
  {
   "id": "ask-a-question",
   "goal": "Ask sales a question",
   "actor": "returning_buyer",
   "through": ["pricing", "contact"],
   "watch": [
    "The contact form asks only what sales needs to reply.",
    "After sending, the page says what happens next and when.",
    "An error keeps the message the visitor typed."
   ]
  }
 ],
 "research": [
  "Which words do people in this market use for the problem, as opposed to the product's own feature names?",
  "Which competitors do visitors compare against, and how do those sites explain price and value?",
  "What proof does this market trust: customer logos, numbers, reviews, certifications, a free trial?",
  "Which regulations apply to sign-up and marketing consent here?",
  "What questions do sales or support hear most from people who have not bought yet?"
 ],
 "sources": [
  { "name": "Nielsen Norman Group — 10 usability heuristics", "url": "https://www.nngroup.com/articles/ten-usability-heuristics/", "why": "The baseline vocabulary for reviewing any screen." },
  { "name": "GOV.UK — content design: writing for GOV.UK", "url": "https://www.gov.uk/guidance/content-design/writing-for-gov-uk", "why": "Researched guidance on plain language and how people read on screens." },
  { "name": "Baymard Institute — research", "url": "https://baymard.com/research", "why": "Research on account creation, form length and trust signals before purchase." },
  { "name": "Deceptive Patterns (Harry Brignull)", "url": "https://www.deceptive.design/", "why": "The catalogue of patterns that win a sign-up and lose the customer." }
 ]
}
