{
 "schema_version": 1,
 "id": "content",
 "name": "Docs and help centre",
 "when": "Documentation, help centres, knowledge bases and publications: people arrive with a question and leave when it is answered.",
 "actors": [
  {
   "actor": "question_seeker",
   "who": "Someone in the middle of a task who hit a problem and came to find the answer.",
   "questions": [
    "Which questions bring people here most often, in the words they type into search?",
    "Where do they arrive from: a search engine, a link inside the product, an error message, a colleague?",
    "Do they read the page or scan it for one step, a code sample or a setting name?",
    "What do they do when the page does not answer them: search again, contact support, give up?",
    "Which device and which language do they read on?"
   ]
  },
  {
   "actor": "learner",
   "who": "Someone new to the product working through it in order, from first steps to a working setup.",
   "questions": [
    "What does a first working result look like for them, and how long should it take?",
    "Which concepts do they need before which tasks?",
    "Where do they stop and why — a missing prerequisite, an unexplained term, a broken example?"
   ]
  }
 ],
 "screens": [
  { "id": "home", "name": "Docs home", "lens": "content", "does": "Sees what is covered and picks a starting point or searches." },
  { "id": "search-results", "name": "Search results", "lens": "content", "does": "Recognises the page that answers the question from its title and excerpt." },
  { "id": "article", "name": "Article or guide", "lens": "content", "does": "Finds the answer on the page and acts on it." },
  { "id": "reference", "name": "Reference page", "lens": "data", "does": "Looks up one exact value, parameter or setting." },
  { "id": "feedback", "name": "Was this helpful", "lens": "transaction", "does": "Says the page did or did not answer the question, in one action." },
  { "id": "contact", "name": "Contact support", "lens": "transaction", "does": "Asks for help without retyping what the page already knows." }
 ],
 "journeys": [
  {
   "id": "search-and-answer",
   "goal": "Find the answer to one question",
   "actor": "question_seeker",
   "through": ["home", "search-results", "article"],
   "watch": [
    "The answer is visible without scrolling past an introduction at a phone viewport.",
    "Search results show enough of each page to choose without opening several.",
    "The article's headings let the person jump to the part they need."
   ]
  },
  {
   "id": "get-started",
   "goal": "Reach a first working result",
   "actor": "learner",
   "through": ["home", "article", "article", "reference"],
   "watch": [
    "Each guide says what it needs before it starts and what the reader will have at the end.",
    "Code and values can be copied without retyping.",
    "The next step is linked from the end of each page."
   ]
  },
  {
   "id": "give-up-and-ask",
   "goal": "Get help when the docs did not answer",
   "actor": "question_seeker",
   "through": ["article", "feedback", "contact"],
   "watch": [
    "The way to ask for help is reachable from the page that failed, not only from the home page.",
    "The contact form does not ask again for what the page already knows (the page, the product version).",
    "After sending, the page says when to expect an answer."
   ]
  }
 ],
 "research": [
  "Which search terms bring people to the docs, and which of them return nothing useful?",
  "Which pages have the most exits to support, and what do those support tickets ask?",
  "What vocabulary do people use for the product's features, as opposed to the product's own names?",
  "Which versions of the product do readers run, and do pages say which version they describe?",
  "What reading level and languages does the audience need?"
 ],
 "sources": [
  { "name": "GOV.UK — content design: writing for GOV.UK", "url": "https://www.gov.uk/guidance/content-design/writing-for-gov-uk", "why": "Researched guidance on how people read on screens and how to write so they find the answer." },
  { "name": "Nielsen Norman Group — 10 usability heuristics", "url": "https://www.nngroup.com/articles/ten-usability-heuristics/", "why": "Help and documentation is heuristic 10; the baseline vocabulary for any screen." },
  { "name": "Diátaxis", "url": "https://diataxis.fr/", "why": "A documentation framework separating tutorials, how-to guides, reference and explanation by what the reader needs." },
  { "name": "GitHub Primer", "url": "https://primer.style/", "why": "Content and navigation patterns from a documentation-heavy product." }
 ]
}
